{
  "id": "com.mobilestudio.e2etest",
  "name": "E2E Pipeline Test",
  "version": "1.0.0",
  "author": "MobileStudio-AndroidIDE",
  "description": "임시 E2E 검증용 확장 — 파이프라인 검증 후 삭제됩니다.",
  "type": "plugin",
  "download": "https://github.com/MobileStudio-AndroidIDE/MobileStudio-Extensions/releases/download/com.mobilestudio.e2etest-v1.0.0/com.mobilestudio.e2etest-v1.0.0.msext",
  "size": 823,
  "sha256": "ce3735a806350f0079fac5038bd79320c44bb623473039258b531122289c8c7b",
  "minStudioVersion": "1.0.0",
  "permissions": [
    "editor"
  ],
  "languages": [
    "any"
  ],
  "license": "MIT"
}
